{
    "schemaVersion": 1,
    "revision": 0,
    "updatedAt": "2026-09-12T00:00:00.000Z",
    "source": "builtin:Flow-Canvas-模型渠道入参与限制-对外版.csv",
    "refreshIntervalMs": 3600000,
    "kinds": {
        "image": "图片",
        "video": "视频",
        "text": "文字"
    },
    "fields": {
        "model": { "label": "模型", "param": "model", "type": "text", "nodeKey": "model" },
        "prompt": { "label": "提示词", "param": "prompt", "type": "text", "nodeKey": "prompt" },
        "negativePrompt": { "label": "反向提示词", "param": ["negative_prompt", "no"], "type": "text", "nodeKey": "negativePrompt" },
        "resolutionTier": { "label": "画质", "param": ["size", "resolution"], "type": "tier", "nodeKey": "resolutionTier" },
        "ratio": { "label": "画面比例", "param": ["aspect_ratio", "ratio", "ar"], "type": "enum", "nodeKey": "ratio" },
        "duration": { "label": "时长", "param": ["duration", "seconds"], "type": "duration", "nodeKey": "duration" },
        "n": { "label": "单次张数", "param": "n", "type": "range", "nodeKey": "count" },
        "quality": { "label": "生成质量", "param": "quality", "type": "enum", "nodeKey": "quality" },
        "responseFormat": { "label": "返回格式", "param": "response_format", "type": "enum", "nodeKey": "responseFormat" },
        "historyDisabled": { "label": "关闭历史记录", "param": "history_disabled", "type": "boolean", "nodeKey": "historyDisabled" },
        "stream": { "label": "流式返回", "param": "stream", "type": "boolean", "nodeKey": "stream" },
        "referenceImages": { "label": "参考图", "param": ["reference_images", "image_urls", "images"], "type": "references" },
        "firstFrame": { "label": "首帧图", "param": "first_image", "type": "references" },
        "lastFrame": { "label": "尾帧图", "param": "last_image", "type": "references" },
        "referenceVideos": { "label": "参考视频", "param": ["reference_videos", "video_urls", "videos"], "type": "references" },
        "referenceAudios": { "label": "参考音频", "param": ["reference_audios", "audio_urls", "audios"], "type": "references" },
        "webSearch": { "label": "联网搜索", "param": "web_search", "type": "boolean", "nodeKey": "webSearch" },
        "cameraFixed": { "label": "固定镜头", "param": "camera_fixed", "type": "boolean", "nodeKey": "cameraFixed" },
        "generatedAudio": { "label": "生成音频", "param": "generate_audio", "type": "boolean", "nodeKey": "generateAudio" },
        "watermark": { "label": "水印", "param": "watermark", "type": "boolean", "nodeKey": "watermark" },
        "messages": { "label": "对话消息", "param": "messages", "type": "text" },
        "tools": { "label": "工具调用", "param": "tools", "type": "boolean" },
        "workflowId": { "label": "工作流", "param": "workflow_id", "type": "text" },
        "version": { "label": "MJ 版本", "param": "version", "type": "enum" },
        "raw": { "label": "Raw 模式", "param": "raw", "type": "boolean" },
        "stylize": { "label": "Stylize", "param": "stylize", "type": "range" },
        "chaos": { "label": "Chaos", "param": "chaos", "type": "range" },
        "weird": { "label": "Weird", "param": "weird", "type": "range" },
        "imageWeight": { "label": "图片权重", "param": "image_weight", "type": "range" },
        "styleReference": { "label": "风格参考", "param": "style_reference", "type": "references" },
        "styleWeight": { "label": "风格权重", "param": "style_weight", "type": "range" },
        "styleVersion": { "label": "风格版本", "param": "sv", "type": "range" },
        "omniReference": { "label": "全能参考", "param": "omni_reference", "type": "references" },
        "omniWeight": { "label": "全能参考权重", "param": "omni_weight", "type": "range" },
        "profile": { "label": "个性化档案", "param": "profile", "type": "text" },
        "seed": { "label": "随机种子", "param": "seed", "type": "range" },
        "tile": { "label": "无缝拼贴", "param": "tile", "type": "boolean" },
        "draft": { "label": "草稿模式", "param": "draft", "type": "boolean" },
        "repeat": { "label": "重复次数", "param": "repeat", "type": "range" },
        "speed": { "label": "出图速度", "param": "speed", "type": "enum" },
        "visibility": { "label": "可见性", "param": "visibility", "type": "enum" },
        "definition": { "label": "清晰度", "param": "hd", "type": "enum" }
    },
    "capabilities": {
        "referenceImages": { "label": "参考图", "fields": ["referenceImages"], "kinds": ["image", "video"] },
        "referenceVideos": { "label": "参考视频", "fields": ["referenceVideos"], "kinds": ["video"] },
        "referenceAudios": { "label": "参考音频", "fields": ["referenceAudios"], "kinds": ["video"] },
        "firstFrame": { "label": "首帧图", "fields": ["firstFrame"], "kinds": ["video"] },
        "lastFrame": { "label": "尾帧图", "fields": ["lastFrame"], "kinds": ["video"] },
        "webSearch": { "label": "联网搜索", "fields": ["webSearch"], "kinds": ["video", "image"] },
        "cameraFixed": { "label": "固定镜头", "fields": ["cameraFixed"], "kinds": ["video"] },
        "generatedAudio": { "label": "生成音频", "fields": ["generatedAudio"], "kinds": ["video"] },
        "watermark": { "label": "水印", "fields": ["watermark"], "kinds": ["video"] },
        "negativePrompt": { "label": "反向提示词", "fields": ["negativePrompt"], "kinds": ["image"] },
        "stream": { "label": "流式返回", "fields": ["stream"], "kinds": ["image", "text"] },
        "tools": { "label": "工具调用", "fields": ["tools"], "kinds": ["text"] },
        "face": { "label": "人脸素材", "kinds": ["video"] },
        "nsfw": { "label": "无内容审核 / NSFW", "kinds": ["video"] }
    },
    "models": [
        {
            "id": "ravenhash-image.gpt-image-2",
            "label": "gpt-image-2",
            "kind": "image",
            "channel": "RavenHash图片",
            "route": "图片线路",
            "priority": 100,
            "match": {
                "model": ["^gpt-image-2$"]
            },
            "parameters": {
                "accepts": ["model", "prompt", "size", "n", "quality", "response_format", "history_disabled", "stream", "reference_images"],
                "required": ["model", "prompt"]
            },
            "options": {
                "resolutionTier": {
                    "type": "tier",
                    "values": ["1K", "2K", "4K"],
                    "default": "4K",
                    "encode": "dimensions",
                    "note": "支持 1K/2K/4K 及常用比例"
                },
                "n": { "type": "range", "min": 1, "max": 8, "integer": true, "default": 1, "note": "单次 1-8 张" },
                "quality": { "type": "enum", "values": ["auto", "low", "medium", "high"], "default": "high" },
                "responseFormat": { "type": "enum", "values": ["url", "b64_json"], "default": "url" }
            },
            "capabilities": {
                "referenceImages": { "supported": true, "maxBytesPerImage": 52428800, "note": "参考图单张最大 50MB；有参考图时走 /images/edits" },
                "negativePrompt": { "supported": true },
                "stream": { "supported": true }
            },
            "prompt": { "required": true },
            "limits": {
                "concurrency": 3
            },
            "notes": "单次1-8张；参考图单张最大50MB；quality为auto/low/medium/high；支持1K/2K/4K及常用比例；有参考图时走/images/edits"
        },
        {
            "id": "ravenhash-image.gpt-image-2.5-sunburst",
            "label": "gpt-image-2.5-sunburst",
            "kind": "image",
            "channel": "RavenHash图片",
            "route": "图片线路",
            "priority": 110,
            "match": {
                "model": ["^gpt-image-2\\.5-sunburst$"]
            },
            "parameters": {
                "accepts": ["model", "prompt", "size", "n", "quality", "response_format", "history_disabled", "stream", "reference_images"],
                "required": ["model", "prompt"]
            },
            "options": {
                "resolutionTier": {
                    "type": "tier",
                    "values": ["1K", "2K", "4K"],
                    "default": "4K",
                    "encode": "dimensions",
                    "note": "已实测 3840x2160；复用通用图片请求"
                },
                "n": { "type": "unknown", "reason": "复用通用图片请求，未单独维护单次张数上限" }
            },
            "capabilities": {
                "referenceImages": { "supported": true, "note": "已实测使用 2 张参考图；数量上限未单独维护" }
            },
            "prompt": { "required": true },
            "notes": "已成功生成3840x2160并使用2张参考图；2026-09-12实测携带quality=high、response_format=b64_json、history_disabled=true、stream=false生成成功；接收参数不代表每项都已验证生效"
        },
        {
            "id": "midjourney.mj-imagine",
            "label": "mj_imagine",
            "kind": "image",
            "channel": "Midjourney",
            "route": "MJ线路",
            "priority": 100,
            "match": {
                "model": ["^mj_imagine$", "^midjourney$"]
            },
            "parameters": {
                "accepts": ["model", "prompt", "reference_images", "ar", "version", "raw", "stylize", "chaos", "weird", "quality", "image_weight", "style_reference", "style_weight", "omni_reference", "omni_weight", "profile", "seed", "tile", "draft", "repeat", "speed", "visibility", "negative_prompt"],
                "required": ["model", "prompt"]
            },
            "options": {
                "resolutionTier": { "type": "tier", "values": ["1K", "2K"], "default": "1K", "encode": "dimensions" },
                "ratio": { "type": "unknown", "reason": "--ar 支持任意比例，界面提供常用比例" },
                "version": { "type": "enum", "values": ["8.2", "8.1", "7", "6.1", "6", "niji-7"], "note": "仅这些版本会被编译成 --v/--niji" },
                "stylize": { "type": "range", "min": 0, "max": 1000, "integer": true, "default": 100 },
                "chaos": { "type": "range", "min": 0, "max": 100, "integer": true, "default": 0 },
                "weird": { "type": "range", "min": 0, "max": 3000, "integer": true, "default": 0 },